{
  "schema_version": "1",
  "manifest_id": "01890afa-7c5c-7000-8b00-aaaaaaaaaaaa",
  "created_at": "2026-04-27T12:00:00Z",
  "created_by": "ci-bot",
  "base_branch": "main",
  "groups": [
    {
      "id": "schema-bundle",
      "members": [
        "@org/schema",
        "com.org:schema"
      ]
    }
  ],
  "releases": [
    {
      "name": "@org/schema",
      "ecosystem": "npm",
      "group_id": "schema-bundle",
      "previous_version": "0.1.0",
      "new_version": "0.2.0",
      "bump_type": "minor",
      "tag_name": "@org/schema@v0.2.0",
      "previous_tag": "@org/schema@v0.1.0",
      "compare_url": "https://github.com/org/repo/compare/@org/schema@v0.1.0...@org/schema@v0.2.0",
      "is_prerelease": false,
      "changelog": "## What's new\n\n- added optional User.preferredName",
      "contributors": [
        "alice",
        "bob"
      ],
      "first_time_contributors": [
        "bob"
      ],
      "statistics": {
        "commit_count": 7,
        "days_since_last_release": 14,
        "breaking_changes_count": 0,
        "features_count": 1,
        "fixes_count": 2,
        "pr_count": 3
      }
    },
    {
      "name": "com.org:schema",
      "ecosystem": "maven",
      "group_id": "schema-bundle",
      "previous_version": "0.1.0",
      "new_version": "0.2.0",
      "bump_type": "minor",
      "tag_name": "com.org/schema@v0.2.0",
      "is_prerelease": false,
      "changelog": "## What's new\n\n- added optional User.preferredName",
      "contributors": [
        "alice",
        "bob"
      ],
      "first_time_contributors": [],
      "statistics": {
        "commit_count": 7,
        "breaking_changes_count": 0,
        "features_count": 1,
        "fixes_count": 2
      }
    },
    {
      "name": "solo-cli",
      "ecosystem": "cargo",
      "previous_version": "1.3.6",
      "new_version": "2.0.0",
      "bump_type": "major",
      "tag_name": "solo-cli-v2.0.0",
      "is_prerelease": false,
      "changelog": "## Breaking\n\n- new architecture",
      "contributors": [
        "alice"
      ],
      "first_time_contributors": [],
      "statistics": {
        "commit_count": 42,
        "breaking_changes_count": 5,
        "features_count": 12,
        "fixes_count": 3
      },
      "cascade_inputs": [
        {
          "name": "apko-base",
          "bump": "floor_minor"
        }
      ]
    }
  ]
}
